
*** Running vivado
    with args -log tt_um_impostor_WS2812b.vdi -applog -m64 -product Vivado -messageDb vivado.pb -mode batch -source tt_um_impostor_WS2812b.tcl -notrace



****** Vivado v2024.2 (64-bit)
  **** SW Build 5239630 on Fri Nov 08 22:35:27 MST 2024
  **** IP Build 5239520 on Sun Nov 10 16:12:51 MST 2024
  **** SharedData Build 5239561 on Fri Nov 08 14:39:27 MST 2024
  **** Start of session at: Fri Jul 18 15:51:30 2025
    ** Copyright 1986-2022 Xilinx, Inc. All Rights Reserved.
    ** Copyright 2022-2024 Advanced Micro Devices, Inc. All Rights Reserved.

source tt_um_impostor_WS2812b.tcl -notrace
Command: link_design -top tt_um_impostor_WS2812b -part xc7s50csga324-1
Design is defaulting to srcset: sources_1
Design is defaulting to constrset: constrs_1
INFO: [Device 21-403] Loading part xc7s50csga324-1
Netlist sorting complete. Time (s): cpu = 00:00:00 ; elapsed = 00:00:00.001 . Memory (MB): peak = 509.461 ; gain = 0.000
INFO: [Netlist 29-17] Analyzing 8 Unisim elements for replacement
INFO: [Netlist 29-28] Unisim Transformation completed in 0 CPU seconds
INFO: [Project 1-479] Netlist was created with Vivado 2024.2
INFO: [Project 1-570] Preparing netlist for logic optimization
Parsing XDC File [C:/Users/JavierMunozSaez/Documents/GitHub/tinyqv-byte-peripheral-template/test_real_fpga/TiniQVperipheralmockup/tt_um_impostor_WS2812b/tt_um_impostor_WS2812b.srcs/constrs_1/imports/new/constraints.xdc]
WARNING: [Vivado 12-584] No ports matched 'led_rgb0[0]'. [C:/Users/JavierMunozSaez/Documents/GitHub/tinyqv-byte-peripheral-template/test_real_fpga/TiniQVperipheralmockup/tt_um_impostor_WS2812b/tt_um_impostor_WS2812b.srcs/constrs_1/imports/new/constraints.xdc:19]
CRITICAL WARNING: [Common 17-55] 'set_property' expects at least one object. [C:/Users/JavierMunozSaez/Documents/GitHub/tinyqv-byte-peripheral-template/test_real_fpga/TiniQVperipheralmockup/tt_um_impostor_WS2812b/tt_um_impostor_WS2812b.srcs/constrs_1/imports/new/constraints.xdc:19]
Resolution: If [get_<value>] was used to populate the object, check to make sure this command returns at least one valid object.
WARNING: [Vivado 12-584] No ports matched 'led_rgb0[1]'. [C:/Users/JavierMunozSaez/Documents/GitHub/tinyqv-byte-peripheral-template/test_real_fpga/TiniQVperipheralmockup/tt_um_impostor_WS2812b/tt_um_impostor_WS2812b.srcs/constrs_1/imports/new/constraints.xdc:20]
CRITICAL WARNING: [Common 17-55] 'set_property' expects at least one object. [C:/Users/JavierMunozSaez/Documents/GitHub/tinyqv-byte-peripheral-template/test_real_fpga/TiniQVperipheralmockup/tt_um_impostor_WS2812b/tt_um_impostor_WS2812b.srcs/constrs_1/imports/new/constraints.xdc:20]
Resolution: If [get_<value>] was used to populate the object, check to make sure this command returns at least one valid object.
WARNING: [Vivado 12-584] No ports matched 'led_rgb0[2]'. [C:/Users/JavierMunozSaez/Documents/GitHub/tinyqv-byte-peripheral-template/test_real_fpga/TiniQVperipheralmockup/tt_um_impostor_WS2812b/tt_um_impostor_WS2812b.srcs/constrs_1/imports/new/constraints.xdc:21]
CRITICAL WARNING: [Common 17-55] 'set_property' expects at least one object. [C:/Users/JavierMunozSaez/Documents/GitHub/tinyqv-byte-peripheral-template/test_real_fpga/TiniQVperipheralmockup/tt_um_impostor_WS2812b/tt_um_impostor_WS2812b.srcs/constrs_1/imports/new/constraints.xdc:21]
Resolution: If [get_<value>] was used to populate the object, check to make sure this command returns at least one valid object.
WARNING: [Vivado 12-584] No ports matched 'led_rgb1[0]'. [C:/Users/JavierMunozSaez/Documents/GitHub/tinyqv-byte-peripheral-template/test_real_fpga/TiniQVperipheralmockup/tt_um_impostor_WS2812b/tt_um_impostor_WS2812b.srcs/constrs_1/imports/new/constraints.xdc:22]
CRITICAL WARNING: [Common 17-55] 'set_property' expects at least one object. [C:/Users/JavierMunozSaez/Documents/GitHub/tinyqv-byte-peripheral-template/test_real_fpga/TiniQVperipheralmockup/tt_um_impostor_WS2812b/tt_um_impostor_WS2812b.srcs/constrs_1/imports/new/constraints.xdc:22]
Resolution: If [get_<value>] was used to populate the object, check to make sure this command returns at least one valid object.
WARNING: [Vivado 12-584] No ports matched 'led_rgb1[1]'. [C:/Users/JavierMunozSaez/Documents/GitHub/tinyqv-byte-peripheral-template/test_real_fpga/TiniQVperipheralmockup/tt_um_impostor_WS2812b/tt_um_impostor_WS2812b.srcs/constrs_1/imports/new/constraints.xdc:23]
CRITICAL WARNING: [Common 17-55] 'set_property' expects at least one object. [C:/Users/JavierMunozSaez/Documents/GitHub/tinyqv-byte-peripheral-template/test_real_fpga/TiniQVperipheralmockup/tt_um_impostor_WS2812b/tt_um_impostor_WS2812b.srcs/constrs_1/imports/new/constraints.xdc:23]
Resolution: If [get_<value>] was used to populate the object, check to make sure this command returns at least one valid object.
WARNING: [Vivado 12-584] No ports matched 'led_rgb1[2]'. [C:/Users/JavierMunozSaez/Documents/GitHub/tinyqv-byte-peripheral-template/test_real_fpga/TiniQVperipheralmockup/tt_um_impostor_WS2812b/tt_um_impostor_WS2812b.srcs/constrs_1/imports/new/constraints.xdc:24]
CRITICAL WARNING: [Common 17-55] 'set_property' expects at least one object. [C:/Users/JavierMunozSaez/Documents/GitHub/tinyqv-byte-peripheral-template/test_real_fpga/TiniQVperipheralmockup/tt_um_impostor_WS2812b/tt_um_impostor_WS2812b.srcs/constrs_1/imports/new/constraints.xdc:24]
Resolution: If [get_<value>] was used to populate the object, check to make sure this command returns at least one valid object.
WARNING: [Vivado 12-584] No ports matched 'led[0]'. [C:/Users/JavierMunozSaez/Documents/GitHub/tinyqv-byte-peripheral-template/test_real_fpga/TiniQVperipheralmockup/tt_um_impostor_WS2812b/tt_um_impostor_WS2812b.srcs/constrs_1/imports/new/constraints.xdc:27]
CRITICAL WARNING: [Common 17-55] 'set_property' expects at least one object. [C:/Users/JavierMunozSaez/Documents/GitHub/tinyqv-byte-peripheral-template/test_real_fpga/TiniQVperipheralmockup/tt_um_impostor_WS2812b/tt_um_impostor_WS2812b.srcs/constrs_1/imports/new/constraints.xdc:27]
Resolution: If [get_<value>] was used to populate the object, check to make sure this command returns at least one valid object.
WARNING: [Vivado 12-584] No ports matched 'led[1]'. [C:/Users/JavierMunozSaez/Documents/GitHub/tinyqv-byte-peripheral-template/test_real_fpga/TiniQVperipheralmockup/tt_um_impostor_WS2812b/tt_um_impostor_WS2812b.srcs/constrs_1/imports/new/constraints.xdc:28]
CRITICAL WARNING: [Common 17-55] 'set_property' expects at least one object. [C:/Users/JavierMunozSaez/Documents/GitHub/tinyqv-byte-peripheral-template/test_real_fpga/TiniQVperipheralmockup/tt_um_impostor_WS2812b/tt_um_impostor_WS2812b.srcs/constrs_1/imports/new/constraints.xdc:28]
Resolution: If [get_<value>] was used to populate the object, check to make sure this command returns at least one valid object.
WARNING: [Vivado 12-584] No ports matched 'led[2]'. [C:/Users/JavierMunozSaez/Documents/GitHub/tinyqv-byte-peripheral-template/test_real_fpga/TiniQVperipheralmockup/tt_um_impostor_WS2812b/tt_um_impostor_WS2812b.srcs/constrs_1/imports/new/constraints.xdc:29]
CRITICAL WARNING: [Common 17-55] 'set_property' expects at least one object. [C:/Users/JavierMunozSaez/Documents/GitHub/tinyqv-byte-peripheral-template/test_real_fpga/TiniQVperipheralmockup/tt_um_impostor_WS2812b/tt_um_impostor_WS2812b.srcs/constrs_1/imports/new/constraints.xdc:29]
Resolution: If [get_<value>] was used to populate the object, check to make sure this command returns at least one valid object.
WARNING: [Vivado 12-584] No ports matched 'led[3]'. [C:/Users/JavierMunozSaez/Documents/GitHub/tinyqv-byte-peripheral-template/test_real_fpga/TiniQVperipheralmockup/tt_um_impostor_WS2812b/tt_um_impostor_WS2812b.srcs/constrs_1/imports/new/constraints.xdc:30]
CRITICAL WARNING: [Common 17-55] 'set_property' expects at least one object. [C:/Users/JavierMunozSaez/Documents/GitHub/tinyqv-byte-peripheral-template/test_real_fpga/TiniQVperipheralmockup/tt_um_impostor_WS2812b/tt_um_impostor_WS2812b.srcs/constrs_1/imports/new/constraints.xdc:30]
Resolution: If [get_<value>] was used to populate the object, check to make sure this command returns at least one valid object.
WARNING: [Vivado 12-584] No ports matched 'uart_rxd_out'. [C:/Users/JavierMunozSaez/Documents/GitHub/tinyqv-byte-peripheral-template/test_real_fpga/TiniQVperipheralmockup/tt_um_impostor_WS2812b/tt_um_impostor_WS2812b.srcs/constrs_1/imports/new/constraints.xdc:79]
CRITICAL WARNING: [Common 17-55] 'set_property' expects at least one object. [C:/Users/JavierMunozSaez/Documents/GitHub/tinyqv-byte-peripheral-template/test_real_fpga/TiniQVperipheralmockup/tt_um_impostor_WS2812b/tt_um_impostor_WS2812b.srcs/constrs_1/imports/new/constraints.xdc:79]
Resolution: If [get_<value>] was used to populate the object, check to make sure this command returns at least one valid object.
WARNING: [Vivado 12-584] No ports matched 'uart_txd_in'. [C:/Users/JavierMunozSaez/Documents/GitHub/tinyqv-byte-peripheral-template/test_real_fpga/TiniQVperipheralmockup/tt_um_impostor_WS2812b/tt_um_impostor_WS2812b.srcs/constrs_1/imports/new/constraints.xdc:80]
CRITICAL WARNING: [Common 17-55] 'set_property' expects at least one object. [C:/Users/JavierMunozSaez/Documents/GitHub/tinyqv-byte-peripheral-template/test_real_fpga/TiniQVperipheralmockup/tt_um_impostor_WS2812b/tt_um_impostor_WS2812b.srcs/constrs_1/imports/new/constraints.xdc:80]
Resolution: If [get_<value>] was used to populate the object, check to make sure this command returns at least one valid object.
Finished Parsing XDC File [C:/Users/JavierMunozSaez/Documents/GitHub/tinyqv-byte-peripheral-template/test_real_fpga/TiniQVperipheralmockup/tt_um_impostor_WS2812b/tt_um_impostor_WS2812b.srcs/constrs_1/imports/new/constraints.xdc]
INFO: [Opt 31-138] Pushed 0 inverter(s) to 0 load pin(s).
Netlist sorting complete. Time (s): cpu = 00:00:00 ; elapsed = 00:00:00 . Memory (MB): peak = 641.363 ; gain = 0.000
INFO: [Project 1-111] Unisim Transformation Summary:
No Unisim elements were transformed.

7 Infos, 12 Warnings, 12 Critical Warnings and 0 Errors encountered.
link_design completed successfully
link_design: Time (s): cpu = 00:00:04 ; elapsed = 00:00:05 . Memory (MB): peak = 645.387 ; gain = 323.859
Command: opt_design
Attempting to get a license for feature 'Implementation' and/or device 'xc7s50'
INFO: [Common 17-349] Got license for feature 'Implementation' and/or device 'xc7s50'
Running DRC as a precondition to command opt_design

Starting DRC Task
INFO: [DRC 23-27] Running DRC with 2 threads
INFO: [Project 1-461] DRC finished with 0 Errors
INFO: [Project 1-462] Please refer to the DRC report (report_drc) for more information.

Time (s): cpu = 00:00:02 ; elapsed = 00:00:01 . Memory (MB): peak = 685.297 ; gain = 39.910

Starting Cache Timing Information Task
INFO: [Timing 38-35] Done setting XDC timing constraints.
Ending Cache Timing Information Task | Checksum: 2b0722088

Time (s): cpu = 00:00:07 ; elapsed = 00:00:08 . Memory (MB): peak = 1135.848 ; gain = 450.551

Starting Logic Optimization Task

Phase 1 Initialization

Phase 1.1 Core Generation And Design Setup
Phase 1.1 Core Generation And Design Setup | Checksum: 2b0722088

Time (s): cpu = 00:00:00 ; elapsed = 00:00:00.002 . Memory (MB): peak = 1537.152 ; gain = 0.000

Phase 1.2 Setup Constraints And Sort Netlist
Phase 1.2 Setup Constraints And Sort Netlist | Checksum: 2b0722088

Time (s): cpu = 00:00:00 ; elapsed = 00:00:00.003 . Memory (MB): peak = 1537.152 ; gain = 0.000
Phase 1 Initialization | Checksum: 2b0722088

Time (s): cpu = 00:00:00 ; elapsed = 00:00:00.003 . Memory (MB): peak = 1537.152 ; gain = 0.000

Phase 2 Timer Update And Timing Data Collection

Phase 2.1 Timer Update
Phase 2.1 Timer Update | Checksum: 2b0722088

Time (s): cpu = 00:00:00 ; elapsed = 00:00:00.012 . Memory (MB): peak = 1537.152 ; gain = 0.000

Phase 2.2 Timing Data Collection
Phase 2.2 Timing Data Collection | Checksum: 2b0722088

Time (s): cpu = 00:00:00 ; elapsed = 00:00:00.020 . Memory (MB): peak = 1537.152 ; gain = 0.000
Phase 2 Timer Update And Timing Data Collection | Checksum: 2b0722088

Time (s): cpu = 00:00:00 ; elapsed = 00:00:00.021 . Memory (MB): peak = 1537.152 ; gain = 0.000

Phase 3 Retarget
INFO: [Opt 31-1851] Number of loadless carry chains removed were: 0
INFO: [Opt 31-1834] Total Chains To Be Transformed Were: 0 AND Number of Transformed insts Created are: 0
INFO: [Opt 31-138] Pushed 0 inverter(s) to 0 load pin(s).
INFO: [Opt 31-49] Retargeted 0 cell(s).
Phase 3 Retarget | Checksum: 2b0722088

Time (s): cpu = 00:00:00 ; elapsed = 00:00:00.028 . Memory (MB): peak = 1537.152 ; gain = 0.000
Retarget | Checksum: 2b0722088
INFO: [Opt 31-389] Phase Retarget created 0 cells and removed 0 cells

Phase 4 Constant propagation
INFO: [Opt 31-138] Pushed 0 inverter(s) to 0 load pin(s).
Phase 4 Constant propagation | Checksum: 2b0722088

Time (s): cpu = 00:00:00 ; elapsed = 00:00:00.030 . Memory (MB): peak = 1537.152 ; gain = 0.000
Constant propagation | Checksum: 2b0722088
INFO: [Opt 31-389] Phase Constant propagation created 0 cells and removed 0 cells

Phase 5 Sweep
INFO: [Constraints 18-11670] Building netlist checker database with flags, 0x8
Done building netlist checker database: Time (s): cpu = 00:00:00 ; elapsed = 00:00:00 . Memory (MB): peak = 1537.152 ; gain = 0.000
Phase 5 Sweep | Checksum: 2b0722088

Time (s): cpu = 00:00:00 ; elapsed = 00:00:00.033 . Memory (MB): peak = 1537.152 ; gain = 0.000
Sweep | Checksum: 2b0722088
INFO: [Opt 31-389] Phase Sweep created 0 cells and removed 0 cells

Phase 6 BUFG optimization
Phase 6 BUFG optimization | Checksum: 2b0722088

Time (s): cpu = 00:00:00 ; elapsed = 00:00:00.072 . Memory (MB): peak = 1537.152 ; gain = 0.000
BUFG optimization | Checksum: 2b0722088
INFO: [Opt 31-662] Phase BUFG optimization created 0 cells of which 0 are BUFGs and removed 0 cells.

Phase 7 Shift Register Optimization
INFO: [Opt 31-1064] SRL Remap converted 0 SRLs to 0 registers and converted 0 registers of register chains to 0 SRLs
Phase 7 Shift Register Optimization | Checksum: 2b0722088

Time (s): cpu = 00:00:00 ; elapsed = 00:00:00.075 . Memory (MB): peak = 1537.152 ; gain = 0.000
Shift Register Optimization | Checksum: 2b0722088
INFO: [Opt 31-389] Phase Shift Register Optimization created 0 cells and removed 0 cells

Phase 8 Post Processing Netlist
Phase 8 Post Processing Netlist | Checksum: 2b0722088

Time (s): cpu = 00:00:00 ; elapsed = 00:00:00.076 . Memory (MB): peak = 1537.152 ; gain = 0.000
Post Processing Netlist | Checksum: 2b0722088
INFO: [Opt 31-389] Phase Post Processing Netlist created 0 cells and removed 0 cells

Phase 9 Finalization

Phase 9.1 Finalizing Design Cores and Updating Shapes
Phase 9.1 Finalizing Design Cores and Updating Shapes | Checksum: 2b0722088

Time (s): cpu = 00:00:00 ; elapsed = 00:00:00.078 . Memory (MB): peak = 1537.152 ; gain = 0.000

Phase 9.2 Verifying Netlist Connectivity

Starting Connectivity Check Task

Time (s): cpu = 00:00:00 ; elapsed = 00:00:00.009 . Memory (MB): peak = 1537.152 ; gain = 0.000
Phase 9.2 Verifying Netlist Connectivity | Checksum: 2b0722088

Time (s): cpu = 00:00:00 ; elapsed = 00:00:00.088 . Memory (MB): peak = 1537.152 ; gain = 0.000
Phase 9 Finalization | Checksum: 2b0722088

Time (s): cpu = 00:00:00 ; elapsed = 00:00:00.088 . Memory (MB): peak = 1537.152 ; gain = 0.000
Opt_design Change Summary
=========================


-------------------------------------------------------------------------------------------------------------------------
|  Phase                        |  #Cells created  |  #Cells Removed  |  #Constrained objects preventing optimizations  |
-------------------------------------------------------------------------------------------------------------------------
|  Retarget                     |               0  |               0  |                                              0  |
|  Constant propagation         |               0  |               0  |                                              0  |
|  Sweep                        |               0  |               0  |                                              0  |
|  BUFG optimization            |               0  |               0  |                                              0  |
|  Shift Register Optimization  |               0  |               0  |                                              0  |
|  Post Processing Netlist      |               0  |               0  |                                              0  |
-------------------------------------------------------------------------------------------------------------------------


Ending Logic Optimization Task | Checksum: 2b0722088

Time (s): cpu = 00:00:00 ; elapsed = 00:00:00.089 . Memory (MB): peak = 1537.152 ; gain = 0.000

Starting Power Optimization Task
INFO: [Pwropt 34-132] Skipping clock gating for clocks with a period < 2.00 ns.
Ending Power Optimization Task | Checksum: 2b0722088

Time (s): cpu = 00:00:00 ; elapsed = 00:00:00.007 . Memory (MB): peak = 1537.152 ; gain = 0.000

Starting Final Cleanup Task
Ending Final Cleanup Task | Checksum: 2b0722088

Time (s): cpu = 00:00:00 ; elapsed = 00:00:00 . Memory (MB): peak = 1537.152 ; gain = 0.000

Starting Netlist Obfuscation Task
Netlist sorting complete. Time (s): cpu = 00:00:00 ; elapsed = 00:00:00 . Memory (MB): peak = 1537.152 ; gain = 0.000
Ending Netlist Obfuscation Task | Checksum: 2b0722088

Time (s): cpu = 00:00:00 ; elapsed = 00:00:00.001 . Memory (MB): peak = 1537.152 ; gain = 0.000
INFO: [Common 17-83] Releasing license: Implementation
27 Infos, 12 Warnings, 12 Critical Warnings and 0 Errors encountered.
opt_design completed successfully
opt_design: Time (s): cpu = 00:00:13 ; elapsed = 00:00:15 . Memory (MB): peak = 1537.152 ; gain = 891.766
INFO: [Vivado 12-24828] Executing command : report_drc -file tt_um_impostor_WS2812b_drc_opted.rpt -pb tt_um_impostor_WS2812b_drc_opted.pb -rpx tt_um_impostor_WS2812b_drc_opted.rpx
Command: report_drc -file tt_um_impostor_WS2812b_drc_opted.rpt -pb tt_um_impostor_WS2812b_drc_opted.pb -rpx tt_um_impostor_WS2812b_drc_opted.rpx
INFO: [IP_Flow 19-234] Refreshing IP repositories
INFO: [IP_Flow 19-1704] No user IP repositories specified
INFO: [IP_Flow 19-2313] Loaded Vivado IP repository 'C:/Xilinx/Vivado/2024.2/data/ip'.
INFO: [DRC 23-27] Running DRC with 2 threads
INFO: [Vivado_Tcl 2-168] The results of DRC are in file C:/Users/JavierMunozSaez/Documents/GitHub/tinyqv-byte-peripheral-template/test_real_fpga/TiniQVperipheralmockup/tt_um_impostor_WS2812b/tt_um_impostor_WS2812b.runs/impl_1/tt_um_impostor_WS2812b_drc_opted.rpt.
report_drc completed successfully
INFO: [Timing 38-480] Writing timing data to binary archive.
Write ShapeDB Complete: Time (s): cpu = 00:00:00 ; elapsed = 00:00:00.002 . Memory (MB): peak = 1537.152 ; gain = 0.000
Wrote PlaceDB: Time (s): cpu = 00:00:00 ; elapsed = 00:00:00.002 . Memory (MB): peak = 1537.152 ; gain = 0.000
Wrote PulsedLatchDB: Time (s): cpu = 00:00:00 ; elapsed = 00:00:00 . Memory (MB): peak = 1537.152 ; gain = 0.000
Writing XDEF routing.
Writing XDEF routing logical nets.
Writing XDEF routing special nets.
Wrote RouteStorage: Time (s): cpu = 00:00:00 ; elapsed = 00:00:00.012 . Memory (MB): peak = 1537.152 ; gain = 0.000
Wrote Netlist Cache: Time (s): cpu = 00:00:00 ; elapsed = 00:00:00 . Memory (MB): peak = 1537.152 ; gain = 0.000
Wrote Device Cache: Time (s): cpu = 00:00:00 ; elapsed = 00:00:00.003 . Memory (MB): peak = 1537.152 ; gain = 0.000
Write Physdb Complete: Time (s): cpu = 00:00:00 ; elapsed = 00:00:00.023 . Memory (MB): peak = 1537.152 ; gain = 0.000
INFO: [Common 17-1381] The checkpoint 'C:/Users/JavierMunozSaez/Documents/GitHub/tinyqv-byte-peripheral-template/test_real_fpga/TiniQVperipheralmockup/tt_um_impostor_WS2812b/tt_um_impostor_WS2812b.runs/impl_1/tt_um_impostor_WS2812b_opt.dcp' has been generated.
Command: place_design
Attempting to get a license for feature 'Implementation' and/or device 'xc7s50'
INFO: [Common 17-349] Got license for feature 'Implementation' and/or device 'xc7s50'
INFO: [Common 17-83] Releasing license: Implementation
INFO: [DRC 23-27] Running DRC with 2 threads
INFO: [Vivado_Tcl 4-198] DRC finished with 0 Errors
INFO: [Vivado_Tcl 4-199] Please refer to the DRC report (report_drc) for more information.
Running DRC as a precondition to command place_design
INFO: [DRC 23-27] Running DRC with 2 threads
INFO: [Vivado_Tcl 4-198] DRC finished with 0 Errors
INFO: [Vivado_Tcl 4-199] Please refer to the DRC report (report_drc) for more information.
INFO: [Place 30-611] Multithreading enabled for place_design using a maximum of 2 CPUs

Starting Placer Task

Phase 1 Placer Initialization

Phase 1.1 Placer Initialization Netlist Sorting
Netlist sorting complete. Time (s): cpu = 00:00:00 ; elapsed = 00:00:00 . Memory (MB): peak = 1537.152 ; gain = 0.000
Phase 1.1 Placer Initialization Netlist Sorting | Checksum: 25bd51151

Time (s): cpu = 00:00:00 ; elapsed = 00:00:00.001 . Memory (MB): peak = 1537.152 ; gain = 0.000
Netlist sorting complete. Time (s): cpu = 00:00:00 ; elapsed = 00:00:00.001 . Memory (MB): peak = 1537.152 ; gain = 0.000

Phase 1.2 IO Placement/ Clock Placement/ Build Placer Device
INFO: [Timing 38-35] Done setting XDC timing constraints.
Phase 1.2 IO Placement/ Clock Placement/ Build Placer Device | Checksum: 26d9f9b8f

Time (s): cpu = 00:00:00 ; elapsed = 00:00:00.178 . Memory (MB): peak = 1537.152 ; gain = 0.000

Phase 1.3 Build Placer Netlist Model
Phase 1.3 Build Placer Netlist Model | Checksum: 2ed834ce8

Time (s): cpu = 00:00:00 ; elapsed = 00:00:00.289 . Memory (MB): peak = 1537.152 ; gain = 0.000

Phase 1.4 Constrain Clocks/Macros
Phase 1.4 Constrain Clocks/Macros | Checksum: 2ed834ce8

Time (s): cpu = 00:00:00 ; elapsed = 00:00:00.292 . Memory (MB): peak = 1537.152 ; gain = 0.000
Phase 1 Placer Initialization | Checksum: 2ed834ce8

Time (s): cpu = 00:00:00 ; elapsed = 00:00:00.295 . Memory (MB): peak = 1537.152 ; gain = 0.000

Phase 2 Global Placement

Phase 2.1 Floorplanning
Phase 2.1 Floorplanning | Checksum: 2cb017992

Time (s): cpu = 00:00:00 ; elapsed = 00:00:00.360 . Memory (MB): peak = 1537.152 ; gain = 0.000

Phase 2.2 Update Timing before SLR Path Opt
Phase 2.2 Update Timing before SLR Path Opt | Checksum: 315460553

Time (s): cpu = 00:00:00 ; elapsed = 00:00:00.403 . Memory (MB): peak = 1537.152 ; gain = 0.000

Phase 2.3 Post-Processing in Floorplanning
Phase 2.3 Post-Processing in Floorplanning | Checksum: 315460553

Time (s): cpu = 00:00:00 ; elapsed = 00:00:00.404 . Memory (MB): peak = 1537.152 ; gain = 0.000

Phase 2.4 Global Place Phase1
Phase 2.4 Global Place Phase1 | Checksum: 2b53ab0c1

Time (s): cpu = 00:00:01 ; elapsed = 00:00:00.649 . Memory (MB): peak = 1537.152 ; gain = 0.000

Phase 2.5 Global Place Phase2

Phase 2.5.1 UpdateTiming Before Physical Synthesis
Phase 2.5.1 UpdateTiming Before Physical Synthesis | Checksum: 2b53ab0c1

Time (s): cpu = 00:00:01 ; elapsed = 00:00:00.686 . Memory (MB): peak = 1537.152 ; gain = 0.000

Phase 2.5.2 Physical Synthesis In Placer
INFO: [Physopt 32-1035] Found 0 LUTNM shape to break, 3 LUT instances to create LUTNM shape
INFO: [Physopt 32-1044] Break lutnm for timing: one critical 0, two critical 0, total 0, new lutff created 0
INFO: [Physopt 32-1138] End 1 Pass. Optimized 1 net or LUT. Breaked 0 LUT, combined 1 existing LUT and moved 0 existing LUT
INFO: [Physopt 32-65] No nets found for high-fanout optimization.
INFO: [Physopt 32-232] Optimized 0 net. Created 0 new instance.
INFO: [Physopt 32-775] End 1 Pass. Optimized 0 net or cell. Created 0 new cell, deleted 0 existing cell and moved 0 existing cell
INFO: [Physopt 32-670] No setup violation found.  DSP Register Optimization was not performed.
INFO: [Physopt 32-670] No setup violation found.  Shift Register to Pipeline Optimization was not performed.
INFO: [Physopt 32-670] No setup violation found.  Shift Register Optimization was not performed.
INFO: [Physopt 32-670] No setup violation found.  BRAM Register Optimization was not performed.
INFO: [Physopt 32-670] No setup violation found.  URAM Register Optimization was not performed.
INFO: [Physopt 32-949] No candidate nets found for dynamic/static region interface net replication
INFO: [Physopt 32-775] End 1 Pass. Optimized 0 net or cell. Created 0 new cell, deleted 0 existing cell and moved 0 existing cell
Netlist sorting complete. Time (s): cpu = 00:00:00 ; elapsed = 00:00:00 . Memory (MB): peak = 1537.152 ; gain = 0.000

Summary of Physical Synthesis Optimizations
============================================


-----------------------------------------------------------------------------------------------------------------------------------------------------------
|  Optimization                                     |  Added Cells  |  Removed Cells  |  Optimized Cells/Nets  |  Dont Touch  |  Iterations  |  Elapsed   |
-----------------------------------------------------------------------------------------------------------------------------------------------------------
|  LUT Combining                                    |            0  |              1  |                     1  |           0  |           1  |  00:00:00  |
|  Retime                                           |            0  |              0  |                     0  |           0  |           1  |  00:00:00  |
|  Very High Fanout                                 |            0  |              0  |                     0  |           0  |           1  |  00:00:00  |
|  DSP Register                                     |            0  |              0  |                     0  |           0  |           0  |  00:00:00  |
|  Shift Register to Pipeline                       |            0  |              0  |                     0  |           0  |           0  |  00:00:00  |
|  Shift Register                                   |            0  |              0  |                     0  |           0  |           0  |  00:00:00  |
|  BRAM Register                                    |            0  |              0  |                     0  |           0  |           0  |  00:00:00  |
|  URAM Register                                    |            0  |              0  |                     0  |           0  |           0  |  00:00:00  |
|  Dynamic/Static Region Interface Net Replication  |            0  |              0  |                     0  |           0  |           1  |  00:00:00  |
|  Total                                            |            0  |              1  |                     1  |           0  |           4  |  00:00:00  |
-----------------------------------------------------------------------------------------------------------------------------------------------------------


Phase 2.5.2 Physical Synthesis In Placer | Checksum: 2969b2f32

Time (s): cpu = 00:00:01 ; elapsed = 00:00:00.747 . Memory (MB): peak = 1537.152 ; gain = 0.000
Phase 2.5 Global Place Phase2 | Checksum: 260b53d0c

Time (s): cpu = 00:00:01 ; elapsed = 00:00:00.774 . Memory (MB): peak = 1537.152 ; gain = 0.000
Phase 2 Global Placement | Checksum: 260b53d0c

Time (s): cpu = 00:00:01 ; elapsed = 00:00:00.776 . Memory (MB): peak = 1537.152 ; gain = 0.000

Phase 3 Detail Placement

Phase 3.1 Commit Multi Column Macros
Phase 3.1 Commit Multi Column Macros | Checksum: 23db6ac78

Time (s): cpu = 00:00:01 ; elapsed = 00:00:00.818 . Memory (MB): peak = 1537.152 ; gain = 0.000

Phase 3.2 Commit Most Macros & LUTRAMs
Phase 3.2 Commit Most Macros & LUTRAMs | Checksum: 294e4818f

Time (s): cpu = 00:00:01 ; elapsed = 00:00:00.883 . Memory (MB): peak = 1537.152 ; gain = 0.000

Phase 3.3 Area Swap Optimization
Phase 3.3 Area Swap Optimization | Checksum: 2d751fe4f

Time (s): cpu = 00:00:01 ; elapsed = 00:00:00.888 . Memory (MB): peak = 1537.152 ; gain = 0.000

Phase 3.4 Pipeline Register Optimization
Phase 3.4 Pipeline Register Optimization | Checksum: 2da875932

Time (s): cpu = 00:00:01 ; elapsed = 00:00:00.889 . Memory (MB): peak = 1537.152 ; gain = 0.000

Phase 3.5 Small Shape Detail Placement
Phase 3.5 Small Shape Detail Placement | Checksum: 21cd965f4

Time (s): cpu = 00:00:01 ; elapsed = 00:00:00.979 . Memory (MB): peak = 1537.152 ; gain = 0.000

Phase 3.6 Re-assign LUT pins
Phase 3.6 Re-assign LUT pins | Checksum: 27beb8983

Time (s): cpu = 00:00:01 ; elapsed = 00:00:00.982 . Memory (MB): peak = 1537.152 ; gain = 0.000

Phase 3.7 Pipeline Register Optimization
Phase 3.7 Pipeline Register Optimization | Checksum: 29f99e25e

Time (s): cpu = 00:00:01 ; elapsed = 00:00:00.983 . Memory (MB): peak = 1537.152 ; gain = 0.000
Phase 3 Detail Placement | Checksum: 29f99e25e

Time (s): cpu = 00:00:01 ; elapsed = 00:00:00.984 . Memory (MB): peak = 1537.152 ; gain = 0.000

Phase 4 Post Placement Optimization and Clean-Up

Phase 4.1 Post Commit Optimization
INFO: [Timing 38-35] Done setting XDC timing constraints.

Phase 4.1.1 Post Placement Optimization
Post Placement Optimization Initialization | Checksum: 1f2c052b3

Phase 4.1.1.1 BUFG Insertion

Starting Physical Synthesis Task

Phase 1 Physical Synthesis Initialization
INFO: [Physopt 32-721] Multithreading enabled for phys_opt_design using a maximum of 2 CPUs
INFO: [Physopt 32-619] Estimated Timing Summary | WNS=80.397 | TNS=0.000 |
Phase 1 Physical Synthesis Initialization | Checksum: e0ffcbaa

Time (s): cpu = 00:00:00 ; elapsed = 00:00:00.007 . Memory (MB): peak = 1537.152 ; gain = 0.000
INFO: [Place 46-56] BUFG insertion identified 0 candidate nets. Inserted BUFG: 0, Replicated BUFG Driver: 0, Skipped due to Placement/Routing Conflicts: 0, Skipped due to Timing Degradation: 0, Skipped due to netlist editing failed: 0.
Ending Physical Synthesis Task | Checksum: 1de2189b6

Time (s): cpu = 00:00:00 ; elapsed = 00:00:00.008 . Memory (MB): peak = 1537.152 ; gain = 0.000
Phase 4.1.1.1 BUFG Insertion | Checksum: 1f2c052b3

Time (s): cpu = 00:00:01 ; elapsed = 00:00:01 . Memory (MB): peak = 1537.152 ; gain = 0.000

Phase 4.1.1.2 Post Placement Timing Optimization
INFO: [Place 30-746] Post Placement Timing Summary WNS=80.397. For the most accurate timing information please run report_timing.
Phase 4.1.1.2 Post Placement Timing Optimization | Checksum: 1bba30f7a

Time (s): cpu = 00:00:01 ; elapsed = 00:00:01 . Memory (MB): peak = 1537.152 ; gain = 0.000

Time (s): cpu = 00:00:01 ; elapsed = 00:00:01 . Memory (MB): peak = 1537.152 ; gain = 0.000
Phase 4.1 Post Commit Optimization | Checksum: 1bba30f7a

Time (s): cpu = 00:00:01 ; elapsed = 00:00:01 . Memory (MB): peak = 1537.152 ; gain = 0.000

Phase 4.2 Post Placement Cleanup
Phase 4.2 Post Placement Cleanup | Checksum: 1bba30f7a

Time (s): cpu = 00:00:01 ; elapsed = 00:00:01 . Memory (MB): peak = 1537.152 ; gain = 0.000

Phase 4.3 Placer Reporting

Phase 4.3.1 Print Estimated Congestion
INFO: [Place 30-612] Post-Placement Estimated Congestion 
 ____________________________________________________
|           | Global Congestion | Short Congestion  |
| Direction | Region Size       | Region Size       |
|___________|___________________|___________________|
|      North|                1x1|                1x1|
|___________|___________________|___________________|
|      South|                1x1|                1x1|
|___________|___________________|___________________|
|       East|                1x1|                1x1|
|___________|___________________|___________________|
|       West|                1x1|                1x1|
|___________|___________________|___________________|

Phase 4.3.1 Print Estimated Congestion | Checksum: 1bba30f7a

Time (s): cpu = 00:00:01 ; elapsed = 00:00:01 . Memory (MB): peak = 1537.152 ; gain = 0.000
Phase 4.3 Placer Reporting | Checksum: 1bba30f7a

Time (s): cpu = 00:00:01 ; elapsed = 00:00:01 . Memory (MB): peak = 1537.152 ; gain = 0.000

Phase 4.4 Final Placement Cleanup
Netlist sorting complete. Time (s): cpu = 00:00:00 ; elapsed = 00:00:00 . Memory (MB): peak = 1537.152 ; gain = 0.000

Time (s): cpu = 00:00:01 ; elapsed = 00:00:01 . Memory (MB): peak = 1537.152 ; gain = 0.000
Phase 4 Post Placement Optimization and Clean-Up | Checksum: 1a32ddd67

Time (s): cpu = 00:00:01 ; elapsed = 00:00:01 . Memory (MB): peak = 1537.152 ; gain = 0.000
Ending Placer Task | Checksum: 1710f486c

Time (s): cpu = 00:00:01 ; elapsed = 00:00:01 . Memory (MB): peak = 1537.152 ; gain = 0.000
64 Infos, 12 Warnings, 12 Critical Warnings and 0 Errors encountered.
place_design completed successfully
INFO: [Vivado 12-24838] Running report commands "report_control_sets, report_io, report_utilization" in parallel.
Running report generation with 2 threads.
INFO: [Vivado 12-24828] Executing command : report_io -file tt_um_impostor_WS2812b_io_placed.rpt
report_io: Time (s): cpu = 00:00:00 ; elapsed = 00:00:00.036 . Memory (MB): peak = 1537.152 ; gain = 0.000
INFO: [Vivado 12-24828] Executing command : report_utilization -file tt_um_impostor_WS2812b_utilization_placed.rpt -pb tt_um_impostor_WS2812b_utilization_placed.pb
INFO: [Vivado 12-24828] Executing command : report_control_sets -verbose -file tt_um_impostor_WS2812b_control_sets_placed.rpt
report_control_sets: Time (s): cpu = 00:00:00 ; elapsed = 00:00:00.001 . Memory (MB): peak = 1537.152 ; gain = 0.000
Write ShapeDB Complete: Time (s): cpu = 00:00:00 ; elapsed = 00:00:00.002 . Memory (MB): peak = 1537.152 ; gain = 0.000
INFO: [Timing 38-480] Writing timing data to binary archive.
Wrote PlaceDB: Time (s): cpu = 00:00:00 ; elapsed = 00:00:00.011 . Memory (MB): peak = 1537.152 ; gain = 0.000
Wrote PulsedLatchDB: Time (s): cpu = 00:00:00 ; elapsed = 00:00:00 . Memory (MB): peak = 1537.152 ; gain = 0.000
Writing XDEF routing.
Writing XDEF routing logical nets.
Writing XDEF routing special nets.
Wrote RouteStorage: Time (s): cpu = 00:00:00 ; elapsed = 00:00:00.014 . Memory (MB): peak = 1537.152 ; gain = 0.000
Wrote Netlist Cache: Time (s): cpu = 00:00:00 ; elapsed = 00:00:00 . Memory (MB): peak = 1537.152 ; gain = 0.000
Wrote Device Cache: Time (s): cpu = 00:00:00 ; elapsed = 00:00:00.004 . Memory (MB): peak = 1537.152 ; gain = 0.000
Write Physdb Complete: Time (s): cpu = 00:00:00 ; elapsed = 00:00:00.034 . Memory (MB): peak = 1537.152 ; gain = 0.000
INFO: [Common 17-1381] The checkpoint 'C:/Users/JavierMunozSaez/Documents/GitHub/tinyqv-byte-peripheral-template/test_real_fpga/TiniQVperipheralmockup/tt_um_impostor_WS2812b/tt_um_impostor_WS2812b.runs/impl_1/tt_um_impostor_WS2812b_placed.dcp' has been generated.
Command: phys_opt_design
Attempting to get a license for feature 'Implementation' and/or device 'xc7s50'
INFO: [Common 17-349] Got license for feature 'Implementation' and/or device 'xc7s50'

Starting Initial Update Timing Task

Time (s): cpu = 00:00:00 ; elapsed = 00:00:00.032 . Memory (MB): peak = 1548.676 ; gain = 11.523
INFO: [Vivado_Tcl 4-2279] Estimated Timing Summary | WNS= 80.397 | TNS= 0.000 | 
INFO: [Vivado_Tcl 4-383] Design worst setup slack (WNS) is greater than or equal to 0.000 ns. All physical synthesis setup optimizations will be skipped.
INFO: [Vivado_Tcl 4-232] No setup violation found. The netlist was not modified.
INFO: [Common 17-83] Releasing license: Implementation
75 Infos, 12 Warnings, 12 Critical Warnings and 0 Errors encountered.
phys_opt_design completed successfully
Write ShapeDB Complete: Time (s): cpu = 00:00:00 ; elapsed = 00:00:00.002 . Memory (MB): peak = 1566.531 ; gain = 0.008
INFO: [Timing 38-480] Writing timing data to binary archive.
Wrote PlaceDB: Time (s): cpu = 00:00:00 ; elapsed = 00:00:00.012 . Memory (MB): peak = 1566.531 ; gain = 0.000
Wrote PulsedLatchDB: Time (s): cpu = 00:00:00 ; elapsed = 00:00:00 . Memory (MB): peak = 1566.531 ; gain = 0.000
Writing XDEF routing.
Writing XDEF routing logical nets.
Writing XDEF routing special nets.
Wrote RouteStorage: Time (s): cpu = 00:00:00 ; elapsed = 00:00:00.013 . Memory (MB): peak = 1566.531 ; gain = 0.000
Wrote Netlist Cache: Time (s): cpu = 00:00:00 ; elapsed = 00:00:00 . Memory (MB): peak = 1566.531 ; gain = 0.000
Wrote Device Cache: Time (s): cpu = 00:00:00 ; elapsed = 00:00:00.003 . Memory (MB): peak = 1566.531 ; gain = 0.000
Write Physdb Complete: Time (s): cpu = 00:00:00 ; elapsed = 00:00:00.034 . Memory (MB): peak = 1566.531 ; gain = 0.000
INFO: [Common 17-1381] The checkpoint 'C:/Users/JavierMunozSaez/Documents/GitHub/tinyqv-byte-peripheral-template/test_real_fpga/TiniQVperipheralmockup/tt_um_impostor_WS2812b/tt_um_impostor_WS2812b.runs/impl_1/tt_um_impostor_WS2812b_physopt.dcp' has been generated.
Command: route_design
Attempting to get a license for feature 'Implementation' and/or device 'xc7s50'
INFO: [Common 17-349] Got license for feature 'Implementation' and/or device 'xc7s50'


Starting Routing Task
INFO: [Route 35-254] Multithreading enabled for route_design using a maximum of 2 CPUs

Phase 1 Build RT Design
Checksum: PlaceDB: bbcc630a ConstDB: 0 ShapeSum: ab1b22c RouteDB: aa913336
Post Restoration Checksum: NetGraph: fd0c9cbe | NumContArr: 66e18a96 | Constraints: c2a8fa9d | Timing: c2a8fa9d
Phase 1 Build RT Design | Checksum: 2e9401c8e

Time (s): cpu = 00:00:17 ; elapsed = 00:00:18 . Memory (MB): peak = 1655.664 ; gain = 89.133

Phase 2 Router Initialization

Phase 2.1 Fix Topology Constraints
Phase 2.1 Fix Topology Constraints | Checksum: 2e9401c8e

Time (s): cpu = 00:00:17 ; elapsed = 00:00:18 . Memory (MB): peak = 1655.664 ; gain = 89.133

Phase 2.2 Pre Route Cleanup
Phase 2.2 Pre Route Cleanup | Checksum: 2e9401c8e

Time (s): cpu = 00:00:17 ; elapsed = 00:00:18 . Memory (MB): peak = 1655.664 ; gain = 89.133
 Number of Nodes with overlaps = 0

Phase 2.3 Update Timing
Phase 2.3 Update Timing | Checksum: 1f72d37cf

Time (s): cpu = 00:00:18 ; elapsed = 00:00:18 . Memory (MB): peak = 1683.477 ; gain = 116.945
INFO: [Route 35-416] Intermediate Timing Summary | WNS=80.364 | TNS=0.000  | WHS=-0.143 | THS=-1.789 |


Router Utilization Summary
  Global Vertical Routing Utilization    = 0 %
  Global Horizontal Routing Utilization  = 0 %
  Routable Net Status*
  *Does not include unroutable nets such as driverless and loadless.
  Run report_route_status for detailed report.
  Number of Failed Nets               = 106
    (Failed Nets is the sum of unrouted and partially routed nets)
  Number of Unrouted Nets             = 106
  Number of Partially Routed Nets     = 0
  Number of Node Overlaps             = 0

Phase 2 Router Initialization | Checksum: 214b98e45

Time (s): cpu = 00:00:18 ; elapsed = 00:00:19 . Memory (MB): peak = 1683.477 ; gain = 116.945

Phase 3 Global Routing
Phase 3 Global Routing | Checksum: 214b98e45

Time (s): cpu = 00:00:18 ; elapsed = 00:00:19 . Memory (MB): peak = 1683.477 ; gain = 116.945

Phase 4 Initial Routing

Phase 4.1 Initial Net Routing Pass
Phase 4.1 Initial Net Routing Pass | Checksum: 1ce972c42

Time (s): cpu = 00:00:18 ; elapsed = 00:00:19 . Memory (MB): peak = 1683.477 ; gain = 116.945
Phase 4 Initial Routing | Checksum: 1ce972c42

Time (s): cpu = 00:00:18 ; elapsed = 00:00:19 . Memory (MB): peak = 1683.477 ; gain = 116.945

Phase 5 Rip-up And Reroute

Phase 5.1 Global Iteration 0
 Number of Nodes with overlaps = 2
 Number of Nodes with overlaps = 0
INFO: [Route 35-416] Intermediate Timing Summary | WNS=80.434 | TNS=0.000  | WHS=N/A    | THS=N/A    |

Phase 5.1 Global Iteration 0 | Checksum: 3246dc828

Time (s): cpu = 00:00:18 ; elapsed = 00:00:19 . Memory (MB): peak = 1683.477 ; gain = 116.945

Phase 5.2 Global Iteration 1
 Number of Nodes with overlaps = 0
INFO: [Route 35-416] Intermediate Timing Summary | WNS=80.435 | TNS=0.000  | WHS=N/A    | THS=N/A    |

Phase 5.2 Global Iteration 1 | Checksum: 28df5f95f

Time (s): cpu = 00:00:18 ; elapsed = 00:00:19 . Memory (MB): peak = 1683.477 ; gain = 116.945
Phase 5 Rip-up And Reroute | Checksum: 28df5f95f

Time (s): cpu = 00:00:18 ; elapsed = 00:00:19 . Memory (MB): peak = 1683.477 ; gain = 116.945

Phase 6 Delay and Skew Optimization

Phase 6.1 Delay CleanUp
Phase 6.1 Delay CleanUp | Checksum: 28df5f95f

Time (s): cpu = 00:00:18 ; elapsed = 00:00:19 . Memory (MB): peak = 1683.477 ; gain = 116.945

Phase 6.2 Clock Skew Optimization
Phase 6.2 Clock Skew Optimization | Checksum: 28df5f95f

Time (s): cpu = 00:00:18 ; elapsed = 00:00:19 . Memory (MB): peak = 1683.477 ; gain = 116.945
Phase 6 Delay and Skew Optimization | Checksum: 28df5f95f

Time (s): cpu = 00:00:18 ; elapsed = 00:00:19 . Memory (MB): peak = 1683.477 ; gain = 116.945

Phase 7 Post Hold Fix

Phase 7.1 Hold Fix Iter
INFO: [Route 35-416] Intermediate Timing Summary | WNS=80.527 | TNS=0.000  | WHS=0.118  | THS=0.000  |

Phase 7.1 Hold Fix Iter | Checksum: 30814f909

Time (s): cpu = 00:00:18 ; elapsed = 00:00:19 . Memory (MB): peak = 1683.477 ; gain = 116.945
Phase 7 Post Hold Fix | Checksum: 30814f909

Time (s): cpu = 00:00:18 ; elapsed = 00:00:19 . Memory (MB): peak = 1683.477 ; gain = 116.945

Phase 8 Route finalize

Router Utilization Summary
  Global Vertical Routing Utilization    = 0.0210476 %
  Global Horizontal Routing Utilization  = 0.0203019 %
  Routable Net Status*
  *Does not include unroutable nets such as driverless and loadless.
  Run report_route_status for detailed report.
  Number of Failed Nets               = 0
    (Failed Nets is the sum of unrouted and partially routed nets)
  Number of Unrouted Nets             = 0
  Number of Partially Routed Nets     = 0
  Number of Node Overlaps             = 0

Phase 8 Route finalize | Checksum: 30814f909

Time (s): cpu = 00:00:18 ; elapsed = 00:00:19 . Memory (MB): peak = 1683.477 ; gain = 116.945

Phase 9 Verifying routed nets

 Verification completed successfully
Phase 9 Verifying routed nets | Checksum: 30814f909

Time (s): cpu = 00:00:18 ; elapsed = 00:00:19 . Memory (MB): peak = 1683.477 ; gain = 116.945

Phase 10 Depositing Routes
Phase 10 Depositing Routes | Checksum: 26b767da4

Time (s): cpu = 00:00:18 ; elapsed = 00:00:19 . Memory (MB): peak = 1683.477 ; gain = 116.945

Phase 11 Post Process Routing
Phase 11 Post Process Routing | Checksum: 26b767da4

Time (s): cpu = 00:00:18 ; elapsed = 00:00:19 . Memory (MB): peak = 1683.477 ; gain = 116.945

Phase 12 Post Router Timing
INFO: [Route 35-57] Estimated Timing Summary | WNS=80.527 | TNS=0.000  | WHS=0.118  | THS=0.000  |

INFO: [Route 35-327] The final timing numbers are based on the router estimated timing analysis. For a complete and accurate timing signoff, please run report_timing_summary.
Phase 12 Post Router Timing | Checksum: 26b767da4

Time (s): cpu = 00:00:18 ; elapsed = 00:00:19 . Memory (MB): peak = 1683.477 ; gain = 116.945
Total Elapsed time in route_design: 18.74 secs

Phase 13 Post-Route Event Processing
Phase 13 Post-Route Event Processing | Checksum: fc691125

Time (s): cpu = 00:00:18 ; elapsed = 00:00:19 . Memory (MB): peak = 1683.477 ; gain = 116.945
INFO: [Route 35-16] Router Completed Successfully
Ending Routing Task | Checksum: fc691125

Time (s): cpu = 00:00:18 ; elapsed = 00:00:19 . Memory (MB): peak = 1683.477 ; gain = 116.945

Routing Is Done.
INFO: [Common 17-83] Releasing license: Implementation
87 Infos, 12 Warnings, 12 Critical Warnings and 0 Errors encountered.
route_design completed successfully
route_design: Time (s): cpu = 00:00:18 ; elapsed = 00:00:19 . Memory (MB): peak = 1683.477 ; gain = 116.945
INFO: [Vivado 12-24828] Executing command : report_drc -file tt_um_impostor_WS2812b_drc_routed.rpt -pb tt_um_impostor_WS2812b_drc_routed.pb -rpx tt_um_impostor_WS2812b_drc_routed.rpx
Command: report_drc -file tt_um_impostor_WS2812b_drc_routed.rpt -pb tt_um_impostor_WS2812b_drc_routed.pb -rpx tt_um_impostor_WS2812b_drc_routed.rpx
INFO: [IP_Flow 19-1839] IP Catalog is up to date.
INFO: [DRC 23-27] Running DRC with 2 threads
INFO: [Vivado_Tcl 2-168] The results of DRC are in file C:/Users/JavierMunozSaez/Documents/GitHub/tinyqv-byte-peripheral-template/test_real_fpga/TiniQVperipheralmockup/tt_um_impostor_WS2812b/tt_um_impostor_WS2812b.runs/impl_1/tt_um_impostor_WS2812b_drc_routed.rpt.
report_drc completed successfully
INFO: [Vivado 12-24828] Executing command : report_methodology -file tt_um_impostor_WS2812b_methodology_drc_routed.rpt -pb tt_um_impostor_WS2812b_methodology_drc_routed.pb -rpx tt_um_impostor_WS2812b_methodology_drc_routed.rpx
Command: report_methodology -file tt_um_impostor_WS2812b_methodology_drc_routed.rpt -pb tt_um_impostor_WS2812b_methodology_drc_routed.pb -rpx tt_um_impostor_WS2812b_methodology_drc_routed.rpx
INFO: [Timing 38-35] Done setting XDC timing constraints.
INFO: [DRC 23-133] Running Methodology with 2 threads
INFO: [Vivado_Tcl 2-1520] The results of Report Methodology are in file C:/Users/JavierMunozSaez/Documents/GitHub/tinyqv-byte-peripheral-template/test_real_fpga/TiniQVperipheralmockup/tt_um_impostor_WS2812b/tt_um_impostor_WS2812b.runs/impl_1/tt_um_impostor_WS2812b_methodology_drc_routed.rpt.
report_methodology completed successfully
INFO: [Vivado 12-24828] Executing command : report_timing_summary -max_paths 10 -report_unconstrained -file tt_um_impostor_WS2812b_timing_summary_routed.rpt -pb tt_um_impostor_WS2812b_timing_summary_routed.pb -rpx tt_um_impostor_WS2812b_timing_summary_routed.rpx -warn_on_violation 
INFO: [Timing 38-35] Done setting XDC timing constraints.
INFO: [Timing 38-91] UpdateTimingParams: Speed grade: -1, Delay Type: min_max.
INFO: [Timing 38-191] Multithreading enabled for timing update using a maximum of 2 CPUs
INFO: [Vivado 12-24838] Running report commands "report_incremental_reuse, report_route_status" in parallel.
Running report generation with 2 threads.
INFO: [Vivado 12-24828] Executing command : report_route_status -file tt_um_impostor_WS2812b_route_status.rpt -pb tt_um_impostor_WS2812b_route_status.pb
INFO: [Vivado 12-24828] Executing command : report_incremental_reuse -file tt_um_impostor_WS2812b_incremental_reuse_routed.rpt
INFO: [Vivado_Tcl 4-1062] Incremental flow is disabled. No incremental reuse Info to report.
INFO: [Vivado 12-24828] Executing command : report_power -file tt_um_impostor_WS2812b_power_routed.rpt -pb tt_um_impostor_WS2812b_power_summary_routed.pb -rpx tt_um_impostor_WS2812b_power_routed.rpx
Command: report_power -file tt_um_impostor_WS2812b_power_routed.rpt -pb tt_um_impostor_WS2812b_power_summary_routed.pb -rpx tt_um_impostor_WS2812b_power_routed.rpx
Running Vector-less Activity Propagation...

Finished Running Vector-less Activity Propagation
104 Infos, 12 Warnings, 12 Critical Warnings and 0 Errors encountered.
report_power completed successfully
INFO: [Vivado 12-24828] Executing command : report_clock_utilization -file tt_um_impostor_WS2812b_clock_utilization_routed.rpt
INFO: [Vivado 12-24828] Executing command : report_bus_skew -warn_on_violation -file tt_um_impostor_WS2812b_bus_skew_routed.rpt -pb tt_um_impostor_WS2812b_bus_skew_routed.pb -rpx tt_um_impostor_WS2812b_bus_skew_routed.rpx
INFO: [Timing 38-91] UpdateTimingParams: Speed grade: -1, Delay Type: min_max.
INFO: [Timing 38-191] Multithreading enabled for timing update using a maximum of 2 CPUs
generate_parallel_reports: Time (s): cpu = 00:00:11 ; elapsed = 00:00:07 . Memory (MB): peak = 1744.355 ; gain = 60.879
Write ShapeDB Complete: Time (s): cpu = 00:00:00 ; elapsed = 00:00:00.001 . Memory (MB): peak = 1746.410 ; gain = 0.000
INFO: [Timing 38-480] Writing timing data to binary archive.
Wrote PlaceDB: Time (s): cpu = 00:00:00 ; elapsed = 00:00:00.005 . Memory (MB): peak = 1746.410 ; gain = 0.000
Wrote PulsedLatchDB: Time (s): cpu = 00:00:00 ; elapsed = 00:00:00 . Memory (MB): peak = 1746.410 ; gain = 0.000
Writing XDEF routing.
Writing XDEF routing logical nets.
Writing XDEF routing special nets.
Wrote RouteStorage: Time (s): cpu = 00:00:00 ; elapsed = 00:00:00.015 . Memory (MB): peak = 1746.410 ; gain = 0.000
Wrote Netlist Cache: Time (s): cpu = 00:00:00 ; elapsed = 00:00:00.001 . Memory (MB): peak = 1746.410 ; gain = 0.000
Wrote Device Cache: Time (s): cpu = 00:00:00 ; elapsed = 00:00:00.005 . Memory (MB): peak = 1746.410 ; gain = 0.000
Write Physdb Complete: Time (s): cpu = 00:00:00 ; elapsed = 00:00:00.034 . Memory (MB): peak = 1746.410 ; gain = 0.000
INFO: [Common 17-1381] The checkpoint 'C:/Users/JavierMunozSaez/Documents/GitHub/tinyqv-byte-peripheral-template/test_real_fpga/TiniQVperipheralmockup/tt_um_impostor_WS2812b/tt_um_impostor_WS2812b.runs/impl_1/tt_um_impostor_WS2812b_routed.dcp' has been generated.
Command: write_bitstream -force tt_um_impostor_WS2812b.bit
Attempting to get a license for feature 'Implementation' and/or device 'xc7s50'
INFO: [Common 17-349] Got license for feature 'Implementation' and/or device 'xc7s50'
Running DRC as a precondition to command write_bitstream
INFO: [IP_Flow 19-1839] IP Catalog is up to date.
INFO: [DRC 23-27] Running DRC with 2 threads
INFO: [Vivado 12-3199] DRC finished with 0 Errors
INFO: [Vivado 12-3200] Please refer to the DRC report (report_drc) for more information.
INFO: [Designutils 20-2272] Running write_bitstream with 2 threads.
Loading data files...
Loading site data...
Loading route data...
Processing options...
Creating bitmap...
Creating bitstream...
Writing bitstream ./tt_um_impostor_WS2812b.bit...
INFO: [Vivado 12-1842] Bitgen Completed Successfully.
INFO: [Project 1-1876] WebTalk data collection is mandatory when using a ULT device. To see the specific WebTalk data collected for your design, open the usage_statistics_webtalk.html or usage_statistics_webtalk.xml file in the implementation directory.
INFO: [Common 17-83] Releasing license: Implementation
119 Infos, 12 Warnings, 12 Critical Warnings and 0 Errors encountered.
write_bitstream completed successfully
write_bitstream: Time (s): cpu = 00:00:14 ; elapsed = 00:00:12 . Memory (MB): peak = 2235.223 ; gain = 488.812
INFO: [Common 17-206] Exiting Vivado at Fri Jul 18 15:52:42 2025...

*** Running vivado
    with args -log tt_um_impostor_WS2812b.vdi -applog -m64 -product Vivado -messageDb vivado.pb -mode batch -source tt_um_impostor_WS2812b.tcl -notrace



****** Vivado v2024.2 (64-bit)
  **** SW Build 5239630 on Fri Nov 08 22:35:27 MST 2024
  **** IP Build 5239520 on Sun Nov 10 16:12:51 MST 2024
  **** SharedData Build 5239561 on Fri Nov 08 14:39:27 MST 2024
  **** Start of session at: Fri Jul 18 15:55:51 2025
    ** Copyright 1986-2022 Xilinx, Inc. All Rights Reserved.
    ** Copyright 2022-2024 Advanced Micro Devices, Inc. All Rights Reserved.

source tt_um_impostor_WS2812b.tcl -notrace
Command: open_checkpoint tt_um_impostor_WS2812b_routed.dcp
INFO: [Device 21-403] Loading part xc7s50csga324-1
Netlist sorting complete. Time (s): cpu = 00:00:00 ; elapsed = 00:00:00 . Memory (MB): peak = 507.766 ; gain = 0.000
INFO: [Netlist 29-17] Analyzing 8 Unisim elements for replacement
INFO: [Netlist 29-28] Unisim Transformation completed in 0 CPU seconds
INFO: [Project 1-479] Netlist was created with Vivado 2024.2
INFO: [Project 1-570] Preparing netlist for logic optimization
Read ShapeDB Complete: Time (s): cpu = 00:00:00 ; elapsed = 00:00:00.002 . Memory (MB): peak = 598.727 ; gain = 0.000
INFO: [Timing 38-478] Restoring timing data from binary archive.
INFO: [Timing 38-479] Binary timing data restore complete.
INFO: [Project 1-856] Restoring constraints from binary archive.
INFO: [Project 1-853] Binary constraint restore complete.
INFO: [Designutils 20-5722] Start Reading Physical Databases.
Reading placement.
Read Netlist Cache: Time (s): cpu = 00:00:00 ; elapsed = 00:00:00 . Memory (MB): peak = 1116.168 ; gain = 0.000
Reading placer database...
Read Device Cache: Time (s): cpu = 00:00:00 ; elapsed = 00:00:00.013 . Memory (MB): peak = 1116.168 ; gain = 0.000
Read PlaceDB: Time (s): cpu = 00:00:00 ; elapsed = 00:00:00.007 . Memory (MB): peak = 1116.168 ; gain = 0.000
Read PulsedLatchDB: Time (s): cpu = 00:00:00 ; elapsed = 00:00:00.001 . Memory (MB): peak = 1116.168 ; gain = 0.000
Reading routing.
Read RouteStorage: Time (s): cpu = 00:00:00 ; elapsed = 00:00:00.010 . Memory (MB): peak = 1116.168 ; gain = 0.000
Read Physdb Files: Time (s): cpu = 00:00:00 ; elapsed = 00:00:00.047 . Memory (MB): peak = 1116.168 ; gain = 0.000
Restored from archive | CPU: 0.000000 secs | Memory: 0.000000 MB |
Finished XDEF File Restore: Time (s): cpu = 00:00:00 ; elapsed = 00:00:00.129 . Memory (MB): peak = 1116.168 ; gain = 8.352
Netlist sorting complete. Time (s): cpu = 00:00:00 ; elapsed = 00:00:00 . Memory (MB): peak = 1116.168 ; gain = 0.000
INFO: [Project 1-111] Unisim Transformation Summary:
No Unisim elements were transformed.

INFO: [Project 1-604] Checkpoint was created with Vivado v2024.2 (64-bit) build 5239630
open_checkpoint: Time (s): cpu = 00:00:13 ; elapsed = 00:00:15 . Memory (MB): peak = 1116.168 ; gain = 839.625
Command: write_bitstream -force tt_um_impostor_WS2812b.bit
Attempting to get a license for feature 'Implementation' and/or device 'xc7s50'
INFO: [Common 17-349] Got license for feature 'Implementation' and/or device 'xc7s50'
Running DRC as a precondition to command write_bitstream
INFO: [IP_Flow 19-234] Refreshing IP repositories
INFO: [IP_Flow 19-1704] No user IP repositories specified
INFO: [IP_Flow 19-2313] Loaded Vivado IP repository 'C:/Xilinx/Vivado/2024.2/data/ip'.
INFO: [DRC 23-27] Running DRC with 2 threads
INFO: [Vivado 12-3199] DRC finished with 0 Errors
INFO: [Vivado 12-3200] Please refer to the DRC report (report_drc) for more information.
INFO: [Designutils 20-2272] Running write_bitstream with 2 threads.
Loading data files...
Loading site data...
Loading route data...
Processing options...
Creating bitmap...
Creating bitstream...
Writing bitstream ./tt_um_impostor_WS2812b.bit...
INFO: [Vivado 12-1842] Bitgen Completed Successfully.
INFO: [Project 1-1876] WebTalk data collection is mandatory when using a ULT device. To see the specific WebTalk data collected for your design, open the usage_statistics_webtalk.html or usage_statistics_webtalk.xml file in the implementation directory.
INFO: [Common 17-83] Releasing license: Implementation
23 Infos, 0 Warnings, 0 Critical Warnings and 0 Errors encountered.
write_bitstream completed successfully
write_bitstream: Time (s): cpu = 00:00:12 ; elapsed = 00:00:11 . Memory (MB): peak = 1660.371 ; gain = 544.203
INFO: [Common 17-206] Exiting Vivado at Fri Jul 18 15:56:21 2025...
